{
  "ns": "github:hubspot",
  "name": "crm-api",
  "title": "HubSpot CRM API",
  "summary": "Contacts, companies, deals and tickets.",
  "category": "productivity",
  "versions": [
    {
      "version": "1.0.0",
      "type": "git",
      "source": {
        "url": "https://github.com/gopu-bruno/bruno-collections",
        "ref": "main",
        "subdir": "hubspot-crm-api"
      }
    }
  ]
}
