{
  "ns": "github:datadog",
  "name": "api",
  "title": "Datadog API",
  "summary": "Metrics, monitors, logs and dashboards.",
  "category": "devops",
  "versions": [
    {
      "version": "1.0.0",
      "type": "git",
      "source": {
        "url": "https://github.com/gopu-bruno/bruno-collections",
        "ref": "main",
        "subdir": "datadog-api"
      }
    }
  ]
}
