{
  "ns": "github:gopu-bruno",
  "name": "messaging-api",
  "title": "Messaging API",
  "summary": "Send SMS, MMS and WhatsApp messages (Twilio-backed) via the REST API.",
  "category": "comms",
  "versions": [
    {
      "version": "1.0.0",
      "type": "git",
      "source": {
        "url": "https://github.com/gopu-bruno/bruno-collections",
        "ref": "main",
        "subdir": "twilio-messaging"
      }
    }
  ]
}
