{
  "ns": "github:anthropic",
  "name": "claude-api",
  "title": "Claude Messages API",
  "summary": "Anthropic Messages API with tool use and prompt caching.",
  "category": "ai",
  "versions": [
    {
      "version": "1.0.0",
      "type": "git",
      "source": {
        "url": "https://github.com/gopu-bruno/bruno-collections",
        "ref": "main",
        "subdir": "anthropic-claude-api"
      }
    }
  ]
}
