{
  "ns": "github:openai",
  "name": "openai-api",
  "title": "OpenAI API",
  "summary": "Chat completions and models for the OpenAI API.",
  "category": "ai",
  "featured": true,
  "versions": [
    {
      "version": "1.0.0",
      "type": "git",
      "source": {
        "url": "https://github.com/gopu-bruno/bruno-collections",
        "ref": "main",
        "subdir": "openai-openai-api"
      }
    }
  ]
}
