{
  "ns": "github:gopu-bruno",
  "name": "supabase-rest",
  "title": "Supabase REST",
  "summary": "Supabase REST",
  "category": "payments",
  "versions": [
    {
      "version": "1.0.0",
      "type": "git",
      "source": {
        "url": "https://github.com/gopu-bruno/bruno-collections",
        "subdir": "supabase-supabase-rest"
      }
    }
  ]
}
